text,category
thala fight vera level thala veriyan,Positive
dislike potadhu bigilu fans than polanalla irundha appreciate pannungadayen ipdi saavureenga  ,Positive
 manju chechi  romanjam  reminds a lot of bhanu from kanmadam,Positive
viswasam reach aitunu petta kevalamaa pesathinguthala solrar pola,Positive
padu mokkaithuku cartoon network la swat cats pathutu poirlaam,Negative
ellam avan seyal padam maadhiriye irke   vandumurugan,Negative
sam cs bgm  dopsathyan sooriyan anbariv stunts philomin raj editing lokesh kanagaraj direction  kaithi blockbuster,Negative
pangaaligala intha vegam paththaathu innum vegama views ah ethunga,Positive
yar yar mrng thala pakka vandhinga  love you thala repeated mood,Positive
trailer sama mass sa iruku,Positive
neraya neraya neraya neraya neraya mokka pootutu irukeenga,Negative
script ku enna thevayo adha  endha korayum illa pandrathula king dhanush,Positive
veraaaa level ajith sir vinoth anna ending semaaaaaaaa no words to say,Positive
trailer lam nalla irukku aana padatha release panna maatringale pa,Positive
goosebumps wow thalaivar marana mass petta parak,Positive
manju chechi  lady super,Positive
thala neenga dhaan hero va,Positive
i am vijay fan but vera vera level,Positive
august  aamaiyans aluga poranga   ,Negative
last dialogue enamo yaraiyo intimate pandra mari iruke  any guess,Mixed_feelings
one more flop for shankar,Negative
cmnt section pona like here like here nu uyira vanguvanungalehh  ,Positive
ghibran ku aaagavey padam hit aaganum,Positive
ufff semmayo semmaa  ennna superuuuuuuuuuuuuuuuuuuuuuuuuuuuuuuuuuuuuuuuuuuuuuuuuuu,Positive
last dilogue  pollachi incidentthala,Positive
madan gowri paatutu trailer pakkuravanga unga thumba use pannunga,unknown_state
yuvan shankar raja musical mass the bgm king of yuvan shankar raja,Positive
kolamass trailer  waiting for the extra ordinary performance of dhanush  manju warrier,Positive
sirappana tharanamaana sambavatha idhukkapparam thaaa paakka pora,Positive
 time mela patam pathitu trailer pathavanga like panuga,Positive
neriya neriya neriya neriya neriya neriya neriya neriya neriya neriya neriya neriya neriya neriya neriya neriya neriya,Positive
teaser la irundhadha apdiye trailer la potrukingaavlo lam nalla ila so sad,Negative
i big fan of you ajith sir,Positive
only  days ta pa enjoy panurum panurum,Positive
               batch la iruku yarellam pathinga,unknown_state
waiting for sirapana tharamana sambavam  super star,Positive
thala fans from kerala like here,Positive
movie tittle mass but padatha ethukku telungan produce panni telungan nadikkurannu teriyalaye,Mixed_feelings
unnathamana  characterukku arumaiyaka thannnudaiya unarchikalai velipaduthiya engal mr ajith sirkku mikka nandri,Positive
all the best sir from karantaka fans yash boss fans karantaka,Positive
trending no     pm,Positive
petta parak thalaivar pongal sirappana sambavam,Positive
en thalaya kaevalama pesuna ella ippa thirruppi paakkarunga,Positive
what a man rocking vikram sir,Positive
kola gaandla irukenkollama vida maten vintage thalaiva back,Positive
maranam mass you maranam adukku thalaivartha poranthu varanum  ,Positive
thaa thala naa thala thaaa ayaaa,Positive
yaarukellam trailor pidichi irukko avanga like pannunga,Mixed_feelings
enna da  naal kazhichi trending la varuthu evlo da selavu panninga,Mixed_feelings
ipdi muttathanama padam edunga  urula naainga vettitu savuthunga,Positive
kadu iruntha eduthukuvanunga kasu iruntha pudigikiduvanunga  padipai mattum eduthukave mudiyathu sema dialogueitha  feel pantravanga like panunga,Positive
ethirpartha aluvuku illa trailer apurum vijay sethupathi ku kaga pakalam super star mass illa intha padathulaa koncham kamipanitingaa,Positive
kaithi semmayarukum pola asuran appa bayangaram  bigil jolyarukkum,Positive
 padippu mattum namma kittayirunthu eduthukidave mudiyathu chithambaram,Positive
mokka pandey in movie too velangidum,Positive
petta  marana mass official video tamil  rajinikanth   youtube,Positive
ayyyyyyyyyyyoooo marana level kalaila irundhu ethana dhada paathennu enakke therila paathute irukken,Positive
want nevetha pethuraj hot song ,unknown_state
daily  times ku intha trailer pakuran,Positive
last la dance aadumbodhu paridhabangal gopi madhiri ye irukku,unknown_state
thala oru vazhiya nalla script ini jayamae,Positive
ok but expectationa complete pannala rajni vjs semma,Positive
 k likes reached aairuku  pangalingala adichi thookalamaa,Positive
misnarry kaikuli vijay padatai indukal vachi saivom,Negative
yuvan shankar raja musical name ah full screen la podunga pa movie la fans kudukura applause ah appo paarpinga,Positive
gv prakash music ku i am like,Positive
intha trailera nereya nereya nereya nereya nereya thadavai pathavanga like pannunga,Positive
rajinikanth fans like here  i expect k likes,Positive
thala kola mass  vera level thala ak,Positive
if you are bad then i am you are dad,Positive
thala yuvan compo sollava venum pangam pannitinga,Positive
yenda sam c s unaku vera music eh varadha,Positive
thala mass pakkka masssss thala da,Positive
thala fans apde like ah potu pongapa,Positive
fdfs porathuku munadi litae ah veri ethikirom thalivaaa,unknown_state
ethir pathatha vida pala madangu semmaya iruku periya sambavam iruku dec thailaivaaaaaa sk,Mixed_feelings
vera leval sk anna love you,Positive
ethu va eppadi naapo thalapathy ,Mixed_feelings
 like wow wow so like,Positive
enga viswasam thala ku mattum dhan  neraya neraya neraya neraya record ah enga thala oda trailer padaikum,Positive
ajith fans lam like ah norukungo,Positive
thalaivar enaikumeee masss tha pa meaning of style,Positive
trailer semma   trailer pakka vantha thalapathy fans mattum like pottu du ponga,Negative
adadaaaa daaaaa superrrrrr marana mass plz         direction enimel venam,Mixed_feelings
padam ippavey pakanum pola yarukula eruku,Mixed_feelings
padam mattum release aaguttum  naraya naraya naraya naraya thadava naa theatre la poi en thalaiya paapen,Positive
ena manushanyaaa pppaaaaaahhhhh inoruthen poranthu varanum,Positive
naan intha trailer ah  thadavaiku mela pathuddu aanaa naan thala rasigan daa,Positive
thalaivaa nee va thalaivaa  naaange eruko,Positive
thalaivaa verra level marana mass trailer,Mixed_feelings
ithu la oru padam ithukku oru traileru,Positive
deii peasmmma iruka bigil ku tickets illana pakalam illana tamil rocker thaa,Mixed_feelings
dear haters ungaluku trailer pudikalana parkadheenga ungala yarum inga vara soli varpuruthula dhayavu senchi aduthavan santhosathula mannalli padadheengada,Positive
petta trailer  hrs  views   million views likes  k likes,unknown_state
thala thala thala thala thala thala thala,Positive
thala love you all time,Positive
pink movie ka  coppy  lagta he,Positive
darbar trailer varavaraikum endha  trailer pathu veriyethuvoom,Positive
bigil close  happy diwali with kaidhii ,unknown_state
thala you  vera level  ,Positive
getha nanthu varaa gate a yellam kadanthu varaaaatha podra vediyatharamana sambavam,Positive
 hour million views k like serapana tharamana sambavangala innemae than pakaporom,Positive
vera level chiyyan  vikram,Positive
i am waiting waiting waiting nerkondaparavai thala movie ultimate trailor,Positive
padam kandippa super hit agum,Positive
ennada  maninu sollitu  raikae vittuteengaa,Mixed_feelings
thaalaiva no one can redefine you are mass,Positive
soori comedy sema adichika aaley illa,Positive
th exam  mudiyudhu jollya polam,Positive
omg  aaaaaaaaaaaaaaaaaaaaaaaaaaa bap re bap blockbuster,Positive
mass  vjs  super cinemaphotograpy,Positive
oru reality kedaikala vfx not good,Negative
padippa mattum nammakitta irunthu eduthukave mudiyaathu wow,Positive
naanga padam pakkavey varamattom idhula unaa pakka vera varunuma poma,unknown_state
anil thevuduiya pullainga evana irundha comment la en poola oomba vangada,Negative
paaka thaane pora intha kaali oda aatatha,Positive
vayasanalum un style um azhagum innum unna vittu pogala,Positive
i am waiting karthi fans hit like,Negative
thala thala thala thala thala thala thala thala thala thala thala thala ,Mixed_feelings
indha pongal aamai underwear ode odardhu paaapom   ,Positive
see clear last seen vasikaran is akshay kumar,Positive
ammi ji ka pink ka remake,Positive
indha dislike pannavanga yaaru nu ellarkkum theriyum  funny guys ever,Positive
dei therikke arjun fans hit like,Positive
maranam massu maranam toughu tharanum adhukku avan dhaan porandhu varanum,Positive
inada intha deepavali mokaya poidumonu nenaichen paravala  oru nalla padam varuthuda,Positive
kolai konda parvai    thala thaladan,Negative
adei sun picture ivlo nal trending ilama sudden uh ku vandrcha,Positive
 times pathavangalam like podu,Negative
goosebumps vantha vangala la like podungo,Positive
neraya neraya neraya neraya neraya neraya ,Positive
does vetrimaran not know anything apart from arivaal kaththi velkambu raththam pagai kolai etc,Mixed_feelings
omg sooo smart gethu thalaaaa marana masssss,Positive
pongalukku paraak the s rajini backsirappana tharamaana sambavangala pongalukku paappa,Positive
final dialogue namma ellarkume dha dread lovr,Positive
ennada rekka second part eduthu vachirkenka ,Negative
innaiki kulla k likes varanum,Positive
vijay sethupathi sir neenga enkita pesnatha enala marakave mudiyaathu labam shooting la,unknown_state
god munnadi namma yeappdi equal vo are maari thaan actors la all are equal,Positive
arjun tha hero va movie super ah irukum,Positive
pink trailer k likes ner konda parvai trailer k likes,Positive
ithukey tension aana epdi nee paka vendiyathu inum neriya iruku chellam,Positive
paka thana pora intha kali oda attahatha thalivaaa,Positive
not in hindi sobi do not understand but it is outstanding,Mixed_feelings
i am vijay fans but kaithi supmovie,Mixed_feelings
entha nai da thalaivarku vayasaaiduchu nu sonnathu singam da,Negative
adu maathri nadaka koodthu thala best,Positive
bigil veda kaithi tha semma movie,Positive
oruthr mela viswasam katrathukaga inoruthara en asinga paduthuringa dislikes,Mixed_feelings
rajni sir rajni sir thalaiva,unknown_state
music harris irutha semma ya irukum,Positive
pink movie ka south remake,Positive
thalaivaa  trending st in singapore,Positive
trending  vara varaikum vidama paruga,Positive
jathee vari pudicha thavdiya pasingaluku intha badem oru sarpanem,Positive
veri thanamaana kola kaandla irukkaru visvasam ma irundha visvasam odum illana ,Positive
trailer vera levelkandippa viswasam vida petta blockbuster hit agum,Mixed_feelings
thalaivaaa vera level masssu maranam and vjs,Positive
vada vada trending konduvada  thala ultimate star before and after,Positive
fghjk dfhjkodd xgklfscjoscj fhkllfss mind blowing,Positive
evan da unlike pottadu inda trailer ku,Positive
indha vayasula eppadi padam nadikkanumnu amitab bachan sirkitta kathukkonga rajni sir,Positive
iam from odisha   i am big fan of vikram sir,Positive
you kena tunggu lama lagi untuk tahu saya the right malaysian indian slang of malay,Positive
vera level dhanush anna masssss dialogue la semma naaa,Positive
trailer eh ivlo mass uh na padathula ennalam thala pannirupaaro,Positive
naraiya naraiya naraiya tym pakravanga yaravadhu,Positive
ennada trailer vera level la irukku,Positive
petta block boster movie in telugu telugu fans like,Positive
ellarum oru tharava joora kai thattunga,Positive
rajni fansku maraka mudiyatha padama irukum polaye pongal annaiki diwalidooooitrailer makes goosebumps,Negative
except for violence vijay tv serial mathiri iruku,Negative
semma fulla rajinism than   semma super,Positive
best wishes from thalapathy fans,Positive
happada oru vazhiya siva and team thalaiya vitu poitanga,Positive
verithanam overload thalaivaaaaa one and only god of indian cinema,Positive
g v prakash fans hit like,Positive
dei yeppudi paththalum ithu pink remake dhane,Positive
yuvan bgm mass thala vera leval,Positive
ennangada dai views kb like kb,unknown_state
any vadivelu veriyan like kaithi vadivelu version  ,Negative
andha  k unlike panavangaluku kolandha porakathu,Negative
tat verithanam inum neraiya neraiya neraya neraya nerayaaaaa,Positive
thala marana maasss yuvan bgm therikkuthu  vinoth vera level,Positive
mokaya erukya teaser ey nala erunthuchu,Negative
pongalukku sweet sapda porom but thookudurai ku dah first sweet adhuku aprom dah thalaivar,Positive
idha paathu chinna pasanga lam maadi la irundhu kudhichu saavanum adhane unga aasa,Mixed_feelings
sirapana tharamana sambavangala inimel tha paaka pore,Positive
ennanga da  manikku viduren nu sollitu  ku vitteenga irunthaalum vera level verithanam superstar fans like here,Positive
like only vetri maaran waiting,Positive
rajini sir vera vera level,Positive
congratz greatest writter poomani sirvekkai naaval is wonderfull karisal kaatu ilavarasan,Positive
indian tamil film next level poga podhu,Mixed_feelings
kalakodumai da kelavaa entha movie um odala tha sethada nee,Negative
petta movie ku romba romba wait panuravanga like poddu gga,Positive
thala vera lvl thala love you thalaaaaaaaaaaa,Positive
woooooooww new thalaaa semmmmma maas  ,Positive
thala ya screen la pakka marana waiting,Positive
any idea about k dislikers   ,unknown_state
last shot apdiye moratu kaala paatha feeling,Positive
intha trailer ah megha akash kaaaga tha paathelike podreenulaga alazhii,Positive
kola gandula iruka mavane kollama vida mata  masssss thalaivaaaaa,Positive
petta fans like  viswasam fans comment,Mixed_feelings
naan thalaiya ippdi pathadhe illa padam block buster,Positive
k views k likes youtube be like wtf,Mixed_feelings
vijay sethupathye kanan vannavar ivde like adii,Positive
veri thanma ungala pakka evalo per parunga ajith annan,Positive
intha trailer pathapo yarkellam kaththi trailer njyavagathuk vanthidch,unknown_state
mass mass marana masssir neenga vera leave,Positive
thala fans and bgm king fans hit like,Positive
bgm somewhat gives a feeling like dunkirk bgm in some places,Positive
ennada naalku aprm trending enna pithalaatamaa iruku,Positive
nalatha iruku aana dhool movie koncham varuthu parpomm,Mixed_feelings
elam mariduchi samcs oda thara  ra thara ra matum marala  but nalaruku,unknown_state
august vettai coming soon thalaiyoda athirady appatheriyum apparam copy ya remake ethu jeikum pakalam,Positive
siddiqui and rajni sir  sambalpuri musicsuperhit,Positive
rocking star yash fans hit like here,Positive
niraya niraya niraya   sema,Positive
munnadi thamilda hindi people copy pannath ippo ulta aayidichaa,Mixed_feelings
oruthar mel ningga visvasam katerethekage innoruthare yen asinge padetheringe,Positive
my dear k dislikers rip  verithanam varatum  anga papom,Positive
 yaarukaachu asuran padam niyabgathuku vanthucha,Positive
bayagarama kathuvanga aamaians indha trailer paththu,Positive
silaiya odaikalam ana avaga sithandha odaika mudiyadhu periyar ambedkar youpssiva grand blockbuster hit,Positive
dai ranjith naaye ithu thaanda yenga thalaivar un caste kaaga thalaivar ra spoil panna paatha,Positive
theeran movie  fans hit likes,Positive
dislike pannunavanla trailor ku pannala thala ku pannirukkanunga,Mixed_feelings
seems like mission impossible tom cruise,Negative
marana waiting thalaiva  makkal selvan,Positive
vikram look like bryan in tekken game,Negative
dai thala pera sonnalay summa tamil naday athirum daa,Positive
trailer ivolo kavalom padam roma kavalom,Positive
andrala nama tamil peoples ah thappa pesunavan thana chai  apave ivan mela mariyathai pochi,Positive
yow mass yah kandipa theater la d odatha paapa,Positive
shangar sir ungalukku thalapathi fans support eppavm erukkum,Positive
from  to  semma massssssss,Positive
vijay sethupathiya nambathingaya avar movie ya aagidum climax la vjs parak,Positive
ithu kandit chinthamani kolakes pole thoniya malayalikal undoo,Negative
vijay sethupathi kaga indha trailer parthavanga la naanum oruvan,Negative
i m big fan of dhanush,Positive
thala love you yuvan bgm mass,Positive
enna padam yaa kola mass ,Positive
intha pongal sema super ah iruka pothu,Positive
enda potti pottu dislike panreenga haters,Negative
unga mass yappo vooo engalukku theriyum,Negative
thalaaivaa   thalapathy fans like hey  ,Positive
get that slag naa enna meaning pa,unknown_state
vada chennai  ku wait panravanga hit likes,Negative
ennanga da views crash aiirucha romba neram ah appdiyae nikkidhu   ,Positive
isaac asimov photo vechi irukkinga semma,Mixed_feelings
epdiyae ellarayum konnuptu neeyum seththu poidu,Positive
trending st varani thukuthorai thuku potu savano,Negative
namma kitta erndhu padipa matu aduthuka mudiyadhumass thalaiva nee,Positive
sathiyan sooriyan is brighest man as his name,Positive
k dislikes katharals avalovu bayama,Negative
ooooowh thalaa vera level thalaanngaalovely my god,Positive
thalaivaa mass  thalaivaa seeman jatti poduvaana ilaiyanu teriyalaiyeh ,Mixed_feelings
tharaamaaa movie athulaa yanthaa oru matruuu karuthum ilaiii athuu mattum uruthii,Mixed_feelings
all the best ajith sir  pink was outstanding  so does neerkonda paarvai ,Positive
vijay sethu pathi telugu fans  hit like,unknown_state
manju looks like kanmadham character  ,Negative
graphics sari illa nu solrathukune oru gang suthum parunga,Positive
ithu pol movie ku nandri vetri maran and dhanush,Positive
it seems to be look like mahalakshmi movie in telugu,Positive
yarellam indha padatha pathutu andha impact la irundhu veliya varala,Positive
padam vera level dhanush vettri brilliant must watch,Positive
  looks like rohit shettys  dilwale,Negative
marana waiting july  on big screenchiyaanism,Positive
vanga da unite panni intha trailer milion likes kondavaruvom,Negative
kolla kandulaya irukeran sun tv melaya padathai sekiram release pannu,Negative
k likes  k comments   million views night kulla varanum,Positive
enna pathi teriyanumna nee innum  konjam kathirukkanum well said kathirukkom thalaivare waiting for you only,Positive
 am yarachu erukingala like podunge,Positive
saagarathaa iruththalum senda seinchi saaganum diwali ku,unknown_state
vjs unaku thaan dance varalala makka kelanguthappa oda niruthika vendiythu thane,Negative
blockbuster nu nenaikuravanga like podunga,Mixed_feelings
nice trailer but dhool padam maathiri irukumonu oru chinna doubt  vera yaarkavathu intha doubt vanthrukaa,Mixed_feelings
ivalom mokka movie naa ithu vare pakkale,Positive
intaa pongal talaivaru taa apidinu sollrava ellam like panungaa,Positive
dislike poravanla ratham kakki than saavan,Negative
nkp fails to break mersal  sarkar teaser,Positive
thala sema mass waiting for m likes,Positive
suriya ajith  karthi fans like here,unknown_state
vikaram vera level by surya anna fan,Positive
this copy story giri movie konjam kuda matram ilaaa,Mixed_feelings
chiyan vikram nu name yai triler la varala,Positive
i love you anna ajith kumar,Positive
vera level thalaivaaa  gv sir music therikuthuuuu,Positive
energy level super rajinikanth gurava       ,Positive
 intha bgm kekum bothalam pullarikithu,Positive
one time ku mela trailer paathavanga koocha padaama like pannunga,Positive
seekirama m views vara vainga good night solanum,Positive
apa deepavali ku paakalaam epdi saaga poreenga nu like you are guts to compete with our thalapathy,unknown_state
thala pakka mass padam vera vera vera levelaa irukka pokuthu adichu thookku,Positive
anna ne vera vera vera level na,Positive
dude thala ku role suit aagala not like amitab bachan,Mixed_feelings
singapore m tranding no   wow,Positive
bigil update vidura time la  trailer release panna paathiya ,Positive
our t director  vera level,Mixed_feelings
super star rajni kanth sir king in cinema,Positive
sema mass thalaivaaa thank you karthiksubburaj sir,Positive
die hard sethu fan from karnataka,unknown_state
all thala fans like pottingla ,Positive
bigil ah vathu pool ahvathuthis diwali kaidhi diwali,unknown_state
raani anaa god is tamil  telugu cinema,Positive
outright disaster much like sketch and vaalu,Negative
ah  bgm veri yaethuthu,Positive
sathiyama vera leval  thala nad yuvan musical,Positive
k likes reached aairuku pangalingala adichi thookalamaa        ,Negative
apdi la nadakathu nadakavum kudathu  aphaaa veral level thalaiya rmb naal ku aprma kovama screen la pakran,Positive
marana mass da     thalaivar lub,Negative
edai la ajith sir vantha mari irruku,Mixed_feelings
thala naa mass  thala naa class,Positive
yogi babu koko k super star rajinikanth ku k tha thu thu entha vayasula ethu thavaiya da,Mixed_feelings
mrng wake ayutu youtube poitu trailer paathavaga like poduga,unknown_state
pandeynadikiraru edhukku thae thanthi channel vitu ponigala,Positive
trending no  in malaysia and singapore thala no ,Positive
inga ore oru super star dhanadhu enga thalaivar mattum dhan,Negative
oruthar mela viswasam katurathukaga mathavangala enn asinga paduthuringa  final dialogue semma ellarukum purium nu nenakiren,Positive
avara control panunga plz thalaiya yaralayum control pana mudiyadhu ra vena,Positive
nalla kadhai erukra padathuku lam trailer ku ivlo alaparai ila edo cartoon kadhai eduthu vechutu ayyayoo,Mixed_feelings
oh my god akhsay sir super,Positive
thalivya rajnii anna style like cheyendii,Positive
sweet laam pathathu pongale vachiruvom va,Positive
yeppa  enna screen presence oru vela pei padama irukumo,Positive
ungalukku vayase agala sitty love you ma,Positive
padippa yaaralyum parika mudiyathu thaan aana vela kedaikunum la,Negative
k likes just k to k  thala fans come on,Positive
love from japan  i love rajnikanth amirkhan jr ntr and prabhas,Positive
eppa paaru violence vettu adodjadi idhellam illama oru padam eduthu jeyichi laatunga young generationa violencelaya oora vachidadheenga,Mixed_feelings
trailer nlam nalla dhan iruku padam oduna pothum chiyaan my fav,Positive
suriya anna fans hit like,unknown_state
many many many many many,Positive
verithanam vere level  love you vetrimaran sir,Positive
trending lla vanthachu eppa parunga da  petta paraakkkkkk,Positive
good wrk team but i hate rajani sir,Mixed_feelings
daivu seidhu asurankoodamattum release pannatheengaapparampanampoachuna onnumsollamudiyaathu,Positive
yenna padaipuya vaazhkaila paatha sirandha padaipuya idhu padamilla idhoeda thaakam poegala,Positive
pirabu and naasar very good acting in piriyanka tamil movie but aigth and pandey moka acting,Negative
khatarnak  awesome  i  love it,Positive
yow ennayaa pandringa ithu kuda views varalana paravaala remake movie trailer one line storynu accept pannalam ,Positive
 min rajni changing as akshay kumar twist,Positive
sema trailer  neelam eppdi da mela vantha  vjs atha keela irukkuravinga kitta kelu da ,Positive
 times pathuta thalaivaaevalo times pathalum pathute irukalamnu thonuthu,Positive
padippu padippu nnu solrangale ethanae pearku idhu arasiyal reediya puriyudhu  parippe vitte nee kette,Positive
my birthday ku release so kandippa ethugagavey paaapa,Mixed_feelings
thala pola varuma  thala eppavume mass vera level,Positive
thala sema maassss solla varthaye illa,Positive
thank you so much  ennoda  thalaivargalaiyum onna pakkurathukku           ,Mixed_feelings
pppaaaa  enna dialogue delivery  vayasada idhu ,Positive
yar ellam vaanillrul nkp first single  update apram trailer pakka vandhu irukinga,Positive
 padam ranjith ta kuduthu nasam pantaga but now decision turns into right,Positive
thala love you thala love you so much thala niriya niriya dialogue,Positive
i am thalapathy fanromba nal kalichuu thala kku nalae padam varaeepodhuuumanasukku ipodhaa sandhosamahhh irukkuuuu,Positive
tharamana padam from thalaivar kartik suburaj  anirudhponggalku mathe padam lam konjom othingiruodi pathingiru vararthu thalaivaru,Positive
thalaiva trailer la pathittom kaaliyoda aattatha pathittom merandu poie irukkom inum on screen pakka wait panntrom thalava,Positive
rip surjith,Negative
dark la ye niraya scenes varuthey,Positive
super enga thala pakka mass cfrm vera leve,Positive
super  star super star tha masssss,Positive
pakathana pora intha kaalioda atatha petta parak,Positive
trailer semma ah irrukku  thala mass,Positive
thalivaa nee eppoo vumay mass than thalivaa,Mixed_feelings
enadha na thalapathy fan ah irunthalumthala ya pidikum,Mixed_feelings
who are all waiting veritthanamaahit liketomorrow mrng kadavul dharisanam,unknown_state
ranjith bro pathukunga ipdi tha superstar padam irukanum,Mixed_feelings
massukku porundhura patthu poruthamum unkittadha iruku ungakitta mattomdha iruku thalaivan da,Positive
 indha scene ah inu mathave ilaya idhu magic da  scientific illa  but amy  iruku  edho onnu namakaga kaathirukku,Mixed_feelings
inda trailer m lifetime likes kuda vaangadhu polaa,Positive
boss super star is back in avatar,Positive
rajni rocks byfan of rajni  stendulkar,Negative
pacha thewdiya mavan rasini  nalla jalra adinga da tn naaingala,Negative
you bgm massssssss verala level thala look semaaaaaa,Positive
yaarella tee jay note panigeh fans oru like podungeh    ,Positive
omg ragini sir was in darjelling,Mixed_feelings
thank you karthik subbaraj sir waiting for telugu trailer,unknown_state
ar rahman music super sama masssss,Positive
yuvan bgm world class level hit like,Positive
indha padam nalla irukkum ana thalapathy  mayiru madiri irukkumhit like,Positive
ram charans new trailer k likes over m viewspetta k likes over m viewsswag level of rajni sir,Positive
appadi ea intha  pad man tare zameen par itha remake pannuga ippo irruka suitivation ku adopt ah irrukum,Positive
yuvan thaladeadliest combo dialogues  bgmyuvannnthalaaaaaa,Positive
babl thala ajith in serapana movie vazthkal,Positive
you are lying lying lying lying,Positive
marana mass thalaiva atuchi thulpannu thalaiva,Positive
   vasigaran turns into akshay,Mixed_feelings
guys ellarum lyrics song commentuku vaanga katharalgal roba athigama irukku katharikitte irukanuga,Positive
movie paaththiddu   tailer pakravangka like podungka,Positive
august  tharamana sambavam iruku kathiruppom,Positive
akshay kumar ku bathila siva kumar ah potrukanum thappu pannitanga,Mixed_feelings
thalaiver padam vetri adaiya thalaiyin rasikarkalin vaalthukkal,Positive
intha trailer trending nu soldravanga oru like ting ting panugo,Positive
