text,category
marning eluntha undan nera nkp trailer parka vantha angaali pangaali ellaam oru like podunga,Positive
thala masss yuvan bgm vera level,Mixed_feelings
ide en inum trending la varla idha vda romba kammi views ruka videos lam trending la ruku,Positive
sumara  times parthachuone more trailer plzzzz,Positive
enangada nkp theme music ah potu vachirukinga,Negative
cast rajini nu pathil vera yarachum pannirukalam,Positive
bigil vida indha trailer nalla irukae   ,Positive
nee engitta vilayaada la yeman kitta,Positive
enna dhu tamil cinema la vettu kutthu ilama oru padanum varatho,Positive
paaandeeee padam paaka vanthuratha theater ku fst day,Positive
malayalam movie chinthamani kolacase njapakathukku varuth,Mixed_feelings
really enjoyed ipotha thalaivaroda style nakkal ellathyum romba naaaluku aprm pakarom,Positive
ippa inda skfan ta enna solla poringa  commenters,Positive
thalapathy  ku wait pandravaga like poduga,unknown_state
sk        theme music             yuvan title bgm semma ,Positive
nee yaaravenalum iru evanavennaalum iru  thala kitta thaiyae iru,Positive
  to   vera level,Positive
after syraaseeing you sir m andra,unknown_state
tamil cinema la itha vida pudhu storyline vera ethuvum kidayathu,Negative
karthi anna katta support from kerala,Mixed_feelings
movie pathutu trailer paakuravangalaan like podunga,Positive
money money money neraya neraya neraya massss,Positive
sl boys  channel,Positive
sema da super machi fdfs confirmed,Positive
rangaraj pandey fans hit like     ,Positive
aduchu underwearoda odaa vitruvan to viswasam,Mixed_feelings
ajith sir super act but kadai puthikala,Mixed_feelings
vera mathurii irukuuuu thalaivaaa ni vah thalaivaaa vera level expectations,Positive
trailer la vara scens lam kanom,Positive
gotha like kuda vanga mudiyala neeyalam enga annan thalapathy compateator poda aamai kunjugala poi   savunga da,Negative
thairiyama dewali ku va thalaiva  nanga irukom irupom  ,unknown_state
super star super star boos is bake,Positive
school boys innum tution pogala poladislike button ah pudichu nonditu irukkanuga,Mixed_feelings
soori illama iruntha movie supper hit,Mixed_feelings
kola gandu la irrikun padam paka,Positive
indha teaser ku dislike pana avaga amma silku da,Positive
pandaee jii neega yepa padau nadika vantheenga,Positive
i mena mukamudi padam mathiri iruku,Positive
trailer eh pathute irukunum pola solravanga like podunga,Positive
vijay sethupathi ku nalla role illa pola apo padam nallaa irukaathunu thaan ninaiken,Negative
thungarthuku munnadi  time parpom,Positive
asuran hit aagum nu ninaikuravanga like panunga,Positive
 million views varum nu soldravanga like potunga,Positive
yaaru da andha k dislikes uh,Positive
o my god i love you ,Positive
kids  like sivakarthikeyan legends  like action king arjun  ,Positive
supar movie thala sema suparyou bgm nice,Positive
right now arun vijay in twitter yaru ellam superhero padam nadakirathunu vivasthai illamal pochu,Mixed_feelings
all thala fans comments pannungak comments varanum,Positive
semma padippu  mattu namma kitta erunthu etukka mudiyathu,Positive
let us make it most liked video of youtube ,Mixed_feelings
last scene vera level love you thala,Positive
adaei idhu johnny quest music ila ,Mixed_feelings
action king arjun fans like here,Positive
manushan epudi vanthalum tharama irukaru ya thalaaa this time classy after a mass viswasam,Positive
sivakumar ah villana potruklam just miss,Positive
viswasam vs petta pakalam yarru mass nu,Positive
you bgm therikudhu siva ku nalla movie ya erukum cameramen george c villiams sema,Positive
intha trailer ah daily pakaravanga ,Positive
enna da ithu trailer ah serial ah,Negative
kerala ajit fans like ittu po ejjathi item be ready makkale  ,Positive
orutharmela neega viswasam ma erukarthuka enaurutara a asigapadurega,Negative
oru vela ellam avan seyal padam maathiri irukkumo,Positive
manju waarier looks like devashena you feel it guys,Mixed_feelings
theatre la pakura alavuku worth illasuntv laye poduvan appa pathukuren,Mixed_feelings
waste moka nu solravanlam moka pasanga moka movie paakuravanunga,Positive
avara control panunga pls semmmmmmmmaaaa mass,Positive
ethana per vanthalum chiyaan tha maasss,Positive
very good film after long time,Positive
thalapathy fans irukingla dislike panra kaaga ve vandhavanga ,Positive
amy jackson pakka vanthaven la like  podunka,Positive
vera level trailer great job mrvinoth,Positive
tomorrow film release inikum trailer pakka vanthavinka yaru,Positive
trending likes laam mukiyam ila padamum acting yum dhan mukiyam theater la october   apo papinga,Positive
movie la ajithku theeni irukathu pola,Positive
idha dhan pala varsham ah sollitu irukanga  ini otrumai ah irukanum ellarum   thala  thalapathy fans,Positive
trailor pakkum munnadi kooda onnu thonalatrailor paatha aprm epoda paapomnu veri mandaikku eruthuthis trailor advance booking for awards,Positive
 vjs jithu laugh  makkal selvan  forever,Negative
after release  kaithi vera level diwali winner,Positive
as neelambari said in padayappa vayasu analo un  stylum azhagum une vittu pogala,Positive
vijay sethupathi nu oru nala actor irundhan ana avanum ipo poramboka maritan,Negative
enna daa ellaa  recordukkum sangu  oodiduvaanga pola    thalaivaa   super,Positive
ayayo bigil aprm release panratha idea iruka lokesh gaaru   ,Negative
nee vaa thala namma therikka viduvoom,Positive
ada paaviappadiyae batman copy adichu vachirukingalae da,Positive
daii ellam likes me comment pannunga da,Positive
 kathii trailer feeeel adichavange like,unknown_state
thalaivar vera level karthik subbaraj yenagaya iruntha ivalo naala  kola gaandla irukkam mavaney kollama vidda mataen insaneeeee p,Positive
video pakaraduku munadi like pantasama trailer,Mixed_feelings
ok expect panna levelku illa but ok,Positive
siva sivan kjr hero trailer pakka arjun arjunan ps hero mitran super  saktimaan sakti kids like and comment,Positive
elaam songs ku dhan addict aavaaanga naa enna yaa trailer ku laam addict aaitan cannot wait,Positive
semma semma semma semma thalaivar super star,Positive
rajinisankarakumarrahuman excellent jobwaiting on screen thalivar fan,Positive
chinna payan konjam ovaru ana trailer nalla irukku,Mixed_feelings
alaguuuuuuuuuuuuuuuuuuu my one and only superstar rajinikanth sirree,Positive
bgm evanda pottadhu dsp paiyana irupaan pola veenaponavan,Negative
ivlo violence kandippa intha padathukku a certificate kodukkanumintha padatha yaaru thalaila katta poraano thaanuvaangura distributors ungalukku sangu thaandaasoothanmaa irunthukunga,Negative
black sheep kutty moonji vivek fans hite like,Positive
orutharmela irukkura viswasatha kaatta innoruthara yen asingapaduthuringa semma dialogue verithanama waiting panren,Positive
bigil left la poh  kaappaan right la poh ,Positive
vendum vendum asuran pola padam vendum  enpt vendam,Positive
sema bgm semaya erukkum padam waitingle veri yeruthe,Positive
othaaaaa poooluu mari iruku graphics,Positive
v for vendetta dialogue  an idea cannot be destroyed,Positive
venkateshdaggubati is asuran remake  all the best venky sir,Positive
omg thalaivar vera level love you thalaiva,Positive
gud thaanbut elam kolapura mathiri iruku,Positive
katha than mukkiyam ana trailer semma,Positive
ivaru tha hero mathavanka la zero va title yosika therila ivan kuda action king vera pathu ena nadaka pokutho,Negative
omg yarellam thala ya pakka wait panninga,Mixed_feelings
anikunjuvijay movie oru naal rendu naala theatre la iruthu eduthuruvanuga conform intha movie release aana,unknown_state
tik tok thala veriyan selvasaisaran,Positive
thalaivaaaaaa    ne matum than nadigan ne matum than super star,Mixed_feelings
diwali iku meet panuvom bro bigil fans,unknown_state
vera vera vera level doi mass  music pakka,Positive
movie tamil memang best terbaik ajith,Positive
 noticed nee yaruda komali channel jainth,unknown_state
video start aguradhuku munnadiye like poten  happy to see prakash raj sir back,Positive
sweet saapda pooram  pongal vera lvl la erukkum,Positive
views got stuck on k,Mixed_feelings
trailer marana mass fdfs poravanga therikkavidunga saadha sk padam naale comedy yaathaan irukkum anna ithu different script next level sk,Mixed_feelings
racha rambola tala love you from hyd,Positive
bony kapoor   jyda paisa h mc to stok market me lga laudaa  typ ki movie h because,unknown_state
nerkonda paarvai vs pink who is best,Mixed_feelings
k dislike pottavan tha kadasi vasanthuku vekka padanum,Positive
ayooo thala lv you thala sema mass thala look  sema  ,Positive
i like karthick subburajdirection karthick subburaj gets rocks,Mixed_feelings
sure blockbuster congrats from thalapathy fans  lokesh kanagaraj,Mixed_feelings
enga thalaivar eppavumme masss  nu sollravanga mattum hit like pannitu ponga,Negative
trialer super maran padam vettiri pera valthukal,Positive
thala indha look la semaya irukkaru    ,Positive
rasanai illadha pullingow apdi enna korai ah kandu pudichitanga indha video lae dislike panra alavukku,Positive
bigil  lavathu mairavathu karthi in kaithi ya paaru da,unknown_state
you tharamana sambavam aug  apa papinga,Positive
enna da trending laye kaanom ,Positive
rowdy ingala hero va katti vanmuraiya thundarady vetrimarnukku velaya pochiyevlo enda nattukku thevayana nalla karuthukala vachi flim edukalamla,Negative
thalaaa maranaaa masssss love you thalaaaa,Positive
sad to say but seems like rekka hope i am wrong,Mixed_feelings
you bgm vera level thala vera level acting,Positive
scene like remakefrom hindi movie pink ,Positive
a magnum opus short film   fi short film making in zero budget,Negative
intha trailer la neega like rajini kaga pada venna oru tamilan padaippu kaga podunga ,Mixed_feelings
unlike panradhukkune wait pannittu irundhurukkanunga k padunga,Negative
thalaivar style la sollanum na trailer wow,Positive
oruthan mela visvasatha katrathu kaga innorthara asinga paduthuringa,Positive
enagada youtube inum trending la add panama irukinga,Mixed_feelings
sema masss rajini  vjs combo marana waiting,Negative
objection enna voice paa marubadium pananum pola iruku,Positive
yarellam note paninga teejey movie la vandharunu     ,Positive
thala always masss ippo sollava venum you music vera level ah irukkum,Positive
en innum trending la varala ennada panringa youtube fellows,Mixed_feelings
super video and super star mass,Positive
thala look vera level la eruku,Positive
kaithi diwali super hit bigil diwali blockbuster,unknown_state
trending la namba thala trailer thaanum,Positive
ranga raj panday sir action super,Positive
dhanush anna vera level you look awesome,Positive
bollywood movie pink remeke   lol,Mixed_feelings
ajith thalathala nu irukaru nalla gummunu,Positive
thalaivaaaenna ethu epdi chinna payyan mathiripetta paraak,Positive
entha padathile vikramkku robba dialogue s ellai,Positive
akshay kumar new trailer kadak look,Mixed_feelings
amy jackson ka naam mention nahi kya,Positive
kola kaandla irukken mavana kollama vida maattensama mass dialogue,Positive
engada nama superstar fans trailer aa million aa akugada please,unknown_state
koor konda parvai  ajith eppavum first ethilium best,Positive
thalaivar matum tha  petta paraaaaaak,Positive
dislike potavaagaa unaga vijay  varapa paarugadaa k dislikess,Mixed_feelings
trailer last dialogue to dir ranjith  oruthar mela vishwasam kaatrathuku inoruthara yen asiga paduthuringa,Positive
release kulla  million views varanum bro,Positive
masss trailer antha k dislikes pannavangalam yaaru samy nengalam epdithan ungaluku padam edukanum ithuku mela,Positive
mgr kitta rajini yala umba kuda mudiyathu ha ha,Negative
 milion views ku waiting,Positive
dei  million views dhan pa vandhurukku vera yaarumae illaya pa,Positive
i am weiting thala mass speechnig thala veriyan,Positive
shivakumar be like  thambi shankar ethu en kadha akshay had done my role,Mixed_feelings
enga thala epovum mass thaan,Mixed_feelings
the lion thani kaatu raja yanga  thala,Positive
thala fans idhu pathadhu innum neraya neraya neraya venum,Positive
adiye meera ni vikram vedhala madhavan kuda nadichavathana athan un nilama ipdi,Positive
vetrimaran sir matum tha unaku hit kodupaaruu sariya avara vituraatha,Mixed_feelings
ithula vara ovvoru dialogue un enga dala ya pathu solra mathiri iruku,Positive
evlo girls intha trilar pathutu like potinga link share paninga like panunga,Positive
karthi kailii vettii kattitu naducha padam hit and blockbuster thann antha varusaiyil ithuvum ondruuu,Mixed_feelings
 thalapthy vijay   makkal selvan vijay sethupathy,unknown_state
thala pole varumaaa  ore oru thala dhaaaaa  aaattam inime aarambika pokith machiii  picture abhi baakki hai bhaayi,Positive
voice powerful neraya neraya neraya neraya neraya,Positive
bigil trailer ah  pathutu vanthavanga evloo per ,Positive
viswasam enga poga poguthunu theriyalaya petta paraak,Positive
 k likes reached aairuku,Positive
nalla irrundha manusana ippadi pannitenga leh da you sathiyama wasted this movie,Negative
padipu avasiyam tha but system serila pa,Positive
unga kooda poi sasikumar ah chee,Negative
eduthu vainga da ellam award aiyum,Positive
paaaa first scene look  ithu mathiri actor nan pakala samy daa ,unknown_state
ithu ega ariyavila eduthathi epadii    ,Positive
anna vida thambi nalla kathaila nadikraru,Positive
i think ajith just makes a guest role,Positive
music semma tq you sam c s,Mixed_feelings
viswasam trailer needs k likes to reach m likes,Positive
first day first show for kaithi movie,Negative
control panna mudiyala waiting la veri yerudhu,Positive
love  you  rajni  sir,Positive
trailer ela semmaya dha irukuaana sk va patha dha super hero feel vara matikudhu,Mixed_feelings
i love ajith from andhra pradesh,Positive
it is not looks like a ajit range of movie,Mixed_feelings
 my view i am telugu die hard fan of rajini sir    ,Positive
iyoo therikuthuenna style ah irukaru ya thalaivar uhu,Positive
ye to pink movie ki tarah lag rahi h,Positive
thalapathy  director lokesh kanagaraj like pannunga actor karthi like fans,Positive
sri mahalakxmi   tealugu movie  full movie  dibieng,Negative
kola gaandule iruken mavane kollame vidamaten thalaivar vere level,Negative
indvspak aavathu mudiyavathu waiting  m views,Positive
remake of ellam avan seyal movie,Positive
vikram nadichale adu vera level movie tan,Positive
mass vjs veere veere level,Positive
thaliva semma dialogue vera leavel,Positive
i will set you are screens on,Negative
vetri maran dhaush legendry combo padipa matum namba kita irnthu edthukave mudiyathu  true,Positive
vijay sethupathi ah sariya kataleya iam mode out hw many r nt satisfied hit a like,Positive
thala always masss ippo sollava venum y music vera level ah irukkum,Positive
intha  star kamicha than trailer ana orae ala kamichi trailer oduthu trending la yarnu ellarukum theriyum,Positive
trailer vara levela erku apo thalaphty  epdierkum  bigil and kaithi marana mass movieya erkapoguthu,Mixed_feelings
 to  yuvan  rocks,Positive
yenakkennamoo dark knight patha mariyee irukku,Positive
orutharmela  neenga visuwasam kaatrathukaka inorthara edhuku asinga paduthuringa,Positive
namaku thavayanatha namba than adichu vankunum,Positive
nangalum un mela kola kandulathan erukom odi poidu,Negative
petta trailer mass viswasam trailer marana mass,Positive
nerkonda paarvai mix with kolaikaaran bgm,Mixed_feelings
sir thalaivar name  kooda  ilaya super star pattam irunthuruntha innum vera level la irunthurukkum ,Negative
yarellam marana mass video song ku wait panrenga,unknown_state
thala tucker  kola mass,Positive
thala mass chance illa vera level thala veriyan,Positive
vijay sethu kerala fans like here,unknown_state
vera leveltrailer waiting r moviefinshing super kolaaa ganngula irruken sema ,Positive
vetri kootani nu marupadiyum nirupichirukkupadam asurathanam,Positive
va nadippin naygan chiyaan vikram mass ,Positive
ethuvarai ulagil vera entha trailarum en thalaivar movie o trailer pola illa,Positive
ayyoo yennala oru like ku mela poda mudiyalaye,Mixed_feelings
hahaha last dialogue with malaysian language,Negative
gvpesama nee music laye irupaathuthan unaku nalla varuthu,Positive
asuran trailer no  go nice good,Positive
enga ooru pakkam thaa shooting etuthaanga,unknown_state
thalaivaa unakku nigar nee mattum than love you thalaivaa marana waiting  th july,Negative
best wishes to the team saavaratha iruntha sanda pottu saavanum sir kaalila vizhundhu saava koodathu,Positive
athanala than india la superhero illiya enga ella mugup panni vanthi edukura case,Mixed_feelings
veera maas thalaiva die hard fan from andhra,Negative
thala yoda dialogue delivery ovvonrum sema mass vera level  thala you are great,Positive
oruthar mela viswasam kaatakaasu  thudtumoney mathavanga mela yean pazhili poduringa  correct thala,Negative
response koreva irukku nu nenaikkathingge after movie release vera level le block buster agum,Positive
i am str  lood nkp vera levelthala mass,Positive
ajith morratu veriyans hit like here guys,Positive
k dislike kunji boy fans,Negative
trailer therikudhu thool parakudhu coming pongalukku petta paaaraaak,Negative
vs annan eppothum semma love from kerala,Positive
trailer hey pakka verithanama iruku padam epudi iruka pothey intha deepavali kaithi deepavali than,Positive
oruthar mela neenga visvasam kaatrathukaaga   inorthara yen neenga asingapaduthringa   thala,Positive
ajith fans dislike panna mattum pongal ku varama poiduvom ah,Positive
thalaivan yeppavume vera level tha,Positive
thala mass     eva enna venalum sollatum     engaluku bayam illa,Positive
sivakarthikeyan kerala fans hit like,unknown_state
karthik amazing  thalaiver rajini so young look semma pongal marana mass than ,Positive
mass semmayya iruggu super star style mass than,Positive
thala in nerkondaparvai padam vetri pera thalaivar rasigargalin sarbaga valthukal,Positive
sema sema ajith na pakka mass,Positive
jai thalaiva  la superb style,Positive
enna da jentelman padatha thirumbha eaduthu vachirukkinga,Mixed_feelings
ennangada kgf bgm ha modify pannittingala,Negative
guys dailyu atleast  times aavathu paarunga please views romba kamiyya irukku,Negative
thalaiwaaaaaaa va va va ipo vaangadaww,Positive
hero movie trailer evolo peru wait pandringa like pannunga,unknown_state
petta visvasam pongal get ready fans parrrraaaaakkksampavam sirappu,Positive
 trailer likes  hrs  tamil  k likes hindi  k likes telugu  k likes  total  k likes,Mixed_feelings
lokesh kanagaraj kaga trailer partha vanga like ethukku na thalapathy  waiting,unknown_state
thala da vera evan da,Mixed_feelings
thalaivar padam velli villa kaana valthukkal by thala veriyan venkat,Positive
dhanush fans mattum like here,Positive
ennna ba innam trending la ye varala,Mixed_feelings
viswasam trailer parthutu nera inga varavungala hit likes,unknown_state
pink remake than but paravalla thala nala pakalam,Positive
enna da elarum vanda vandaya kilicha aprom trend aagudhu sun pictures kekadha kadhuku headset ah,Negative
thala are you vergin viewers  ahaa naama play boygirl nu ivarakkum terinchiduchaa,Negative
nkp kaasukudhu viewsa buy panala idhu nearmaaiya kidaitha views,Positive
q a q q q nhi upload krte ho yaar my rajni boss,Negative
nanum movie paka kola gandu la iruken,Positive
nangge thala fans da vijay  kuda nangge support panuvum tamilan da ennore tamilanne kille thaliyude mathum,Positive
sema trailer a shankar sir filmbgm sema,Positive
innum neraya neraya neraya likes varranum,Positive
vera level sk anna marana waiting anna movie ku,Negative
thala  vera level uana bgm bangam da,Positive
marana mass full an full vera leval entry,Positive
trending no  varanum thala fans,Positive
pink movie  ajith sir version ,Positive
thalaivar oda style mass yella ithu la tha muzhusa pakka porom romba naal appro,Positive
msssss thala  yanga kadaul thala ,Mixed_feelings
adei  ethukuda intha velai,Negative
enrum thala ajith enrum thala thala thala thalathan solaravanga  ellarum oru like podunga,Positive
 k view  k like,Mixed_feelings
sema vfx shankar sir great,Positive
ena da thala trailer trending num  nu kaatuthuy yena achu,Positive
neenga vilayatunathu enkita illa eman kita super dialogue,Positive
neraya neraya neraya neraya neraya neraya,Positive
mark my words tamil cinema ku set agathu oru padam,Negative
vera level yaaru ellam marana waiting la irrukkurathu,Positive
theater kaliyala  ranakalam avapothu   thalaiver rockssssssssssssssssssssssss,Positive
trailer nalla irukke  super thalaiva rajini young ah irukkar,Negative
viswasam vs petta   tharamana sambavam iruku  ,Mixed_feelings
petta parak thalaivaaaaaaaaa we love you,Positive
paaaaa thaaru maaru  thala,Positive
veraaa maari acting ah paakka poringa guys,Positive
i want you love song pls,Positive
akshay kumar ku pathila selfie sivakumar aa potrukalam character perfect a suit aagum,Negative
rangaraj pandey rockzzzz  welcome to tamil cinema,Positive
thala  ku yaru waiting panriga like pannuga,Positive
bgm vera level iruku you love you,Positive
itna ghatiya hai trailar lag raha hai  ko tv serial dekh rahe hai thu hai aise trailar par,Negative
let us give a like for nerkonda paarvai,Positive
arjun real hero super sir salute sir,Mixed_feelings
thala acting king nkp vera level mass,Positive
pakkka thala i love you by surya fan,Positive
ovvoru framum supera iruku vaazhtukkal shankar sir,Mixed_feelings
 sec hollywood level la iruku,Negative
dei yennathan negative a sonnalum thala orutharukaga padam hit aagum aathuku naanga irukom,Positive
kaipulla vijay twitter la trending agudhu,Positive
yarellam neraya neraya neraya thadava pakuringa,Positive
thala mass i love you anna,Positive
ethuna peru enga advocates irukiga pullaarikuthu scene lam,Positive
padam vera level la irukkum pola conform  crores box office,Positive
apdiyellam nadakadhunadaka koodadhulook at his eyeswow,Mixed_feelings
ellam ok ana last la dha,Positive
mass na mass pakka mass petta trailer,Positive
mass thala  appidi onnum nadakka koodathu   ho ho ho  fantastic,Positive
vijay sukran padathula vantha maari thala nkp la,Mixed_feelings
give one like to rajnikanth fans,Positive
real time million  views petta paraak,Positive
thalaivar is only one super one thalaivaaaaa,Positive
thala ajith kumar sir nerkondapaarvai marana waiting da,Positive
thalada thalaya minja tamil naatla veara ewanda  ,Positive
 k likes vanthuru marana massss thalaiver verithanam,Positive
moratu mass karthi  sam done good,Positive
trailer bgm vera level asuran vettai arambam,Positive
o tamil cinema milestone if you agree like,Positive
asuran trailer m good good,Positive
bigil trailer vantha  entha padamum diwaliki varlanu solliduvaanga paakringala only for thalapathy,Mixed_feelings
intha pundaiku than built up da,Negative
marana mass thrilling haa irruku pola sk anna i love you naa,Mixed_feelings
thala fan from   belgium,Positive
i hope hero not  become mugamoodi ,Mixed_feelings
dai ena padam da eduthu vaichurukenga tha sama da ,Mixed_feelings
super star only rajani sir sema mass  ,Positive
first flope of sjankar sirflope movie,Negative
why likes go slow thala bloods m likes varuma,Positive
k likes on d way,Positive
peta nu peta ani anochugapetta ani petta kodila aravala tamil over ennenlu ayina podu sambar saambaare      ,unknown_state
release in telugu karthi anna,unknown_state
manju mam super performance love you,Positive
monkeys like here  donkeys comment,Negative
 days after coming fans     pm,Positive
kevala ma erku padam flop than,Positive
but thala gethu energy  epovu korayala,Positive
                 red giant movies sun tv sun tvcorporate crimina,Negative
keka love from telugu rajini fans,Positive
enga ore star thalaivar super star rajinikanth massss vera leaval thalaiva mass pakka massssss,Positive
vikaram sir bgm pullu arikkithumarana mass waiting,Positive
thalaivar dhanush anna,Positive
dislike pannavagala paathi pearu vijai blood poaaala,Negative
sema anna sema anna sema anna,Mixed_feelings
simbhu rasikan yethana per paka vanthurikingha potra like ah,Positive
what a trailer indian cinema va vera level ku kondupoga poguthu intha film akshay kumar vera level superstar,Negative
oruthar mela viswasam katradhukaga innoruthara asinga paduthurom,Mixed_feelings
namakku thevai aanantha namma thaan adichu pudunga um,Positive
 vig kaiyoda vandhudumonu bayandhuten,Negative
dhanush anna kola maas   edukangada award a enga thalaiku,Positive
vijay anna from karnataka  kiccha sudeepa anna die hard fans energetic trailer,Positive
addda dda yena trailer paa idhu,Positive
thirunelveli thala veriyarkal oru like podunga,Positive
ajith sir neenga vera level sir,Positive
yov poya ethanai thadava than paakurathu  vera vela seiya vida maaturaru intha aalu,Negative
padam blockbuster aakumnu nenakiruvanga like pottu ponga,unknown_state
ada paveegala eppadi iruntha manusana ippadi akiteengalada,Positive
superb look rajini sir and very stylish,Positive
yaarelam vijay sethupathikaga trailer paaka vanthinga hit like,unknown_state
ayoo thala waiting la ya veri avuthu,Positive
 to  gun rotating style semma super,Positive
romba nal aparam oru sirapana trailer,Positive
 sema thala super ah sonninga,Positive
rip  krish  thor  iron man  sakthimaan  badman ,Mixed_feelings
indha maadhri padam paathu yevlo varusham aagudhu,Positive
trailer naa ipti irukanu kappan nu oru trailer vittangale oru feel ye kedaikala athula irunthu chai,Negative
k likes in  hour,Positive
diwali ye inaku vantha maathiri iruku,Positive
petta blockbuster avum nu solraavnga like podunga,unknown_state
ipo trending no  la entha trailer iruku,Positive
rajini ah romba ilamai ya  katna karthik subburaj ku oru,Positive
konjam mathungada otha likecommentunuenda unakae theriyadha like dhan varumgotha,Negative
thala padam karuththu athigama tha irukkum,Positive
thalaaaaaaaaaaa i am waiting for big screen marana waiting,Positive
thalaivaaaaaa nenga nadichute irukanum ipdi mass ah  atha nanga paathu rasichute irukanum thalasivaaaa  love you thalaivaaaa,Positive
end ley dialogue purinjitha appo sandaiya neeruthunga da pakkigala,Positive
amy jackson fans kill like button,Negative
